{
  "schemaVersion": "source-bundle.v1",
  "collectedAt": "2026-06-15T12:00:00Z",
  "source": {
    "kind": "sample",
    "label": "Bundled synthetic sample, not live GitHub data",
    "metadata": {
      "tutorial": true,
      "publicSafety": "fully synthetic placeholder data"
    }
  },
  "collector": {
    "name": "tutorial-sample-collector",
    "provider": "bundled-sample"
  },
  "targetRepository": {
    "owner": "example-org",
    "name": "delivery-dashboard",
    "defaultBranch": "main",
    "visibility": "public",
    "analysisPullRequestLimit": 4,
    "isValidationTarget": false
  },
  "repositoryMetadata": {
    "id": "sample-repository-001",
    "name": "delivery-dashboard",
    "owner": "example-org",
    "fullName": "example-org/delivery-dashboard",
    "defaultBranch": "main",
    "visibility": "public",
    "isPrivate": false,
    "htmlUrl": "https://example.com/example-org/delivery-dashboard"
  },
  "selection": {
    "strategy": "bundled_tutorial_pull_requests",
    "requestedLimit": 4,
    "collectedCount": 4,
    "source": "bundled tutorial sample"
  },
  "coverage": {
    "status": "partial",
    "sourceFamilies": [
      {
        "family": "repository_metadata",
        "source": "bundled tutorial sample",
        "status": "available",
        "attempts": 1,
        "diagnostics": [],
        "downstreamImpact": "Fictional repository identity is available for report labeling."
      },
      {
        "family": "pull_request_inventory",
        "source": "bundled tutorial sample",
        "status": "available",
        "attempts": 1,
        "diagnostics": [],
        "downstreamImpact": "Four fictional merged pull requests are available for normalization and metrics."
      },
      {
        "family": "pull_request_details",
        "source": "bundled tutorial sample",
        "status": "available",
        "attempts": 1,
        "diagnostics": [],
        "downstreamImpact": "Synthetic lifecycle, files, reviews, checks, and workflow summaries are populated."
      },
      {
        "family": "review_threads",
        "source": "bundled tutorial sample",
        "status": "available",
        "attempts": 1,
        "diagnostics": [],
        "downstreamImpact": "Review-thread counts and comment sources are populated without comment text."
      },
      {
        "family": "workflow_runs",
        "source": "bundled tutorial sample",
        "status": "partial",
        "attempts": 1,
        "diagnostics": ["One PR intentionally has unavailable workflow-run history to demonstrate coverage caveats."],
        "downstreamImpact": "Validation-gap metrics use observed runs where present and preserve unavailable coverage where missing."
      },
      {
        "family": "pr_open_diff",
        "source": "bundled tutorial sample",
        "status": "partial",
        "attempts": 1,
        "diagnostics": ["One PR intentionally lacks PR-open diff data to demonstrate partial diff-growth coverage."],
        "downstreamImpact": "Diff-growth ratios are computed only for PRs with open-time snapshots."
      },
      {
        "family": "languages",
        "source": "bundled tutorial sample",
        "status": "available",
        "attempts": 1,
        "diagnostics": [],
        "downstreamImpact": "Language distribution is illustrative context only."
      },
      {
        "family": "contributor_source",
        "source": "bundled tutorial sample",
        "status": "partial",
        "attempts": 1,
        "diagnostics": ["Synthetic contributor hints omit one reviewer to demonstrate partial profile context."],
        "downstreamImpact": "Contributor-aware comment-source hints are available; scoring and person-level outputs are unchanged."
      }
    ]
  },
  "languageDistribution": {
    "source": "bundled tutorial sample",
    "bytesByLanguage": {
      "TypeScript": 420000,
      "JavaScript": 180000,
      "Markdown": 52000,
      "YAML": 18000
    },
    "coverage": {
      "family": "languages",
      "source": "bundled tutorial sample",
      "status": "available",
      "attempts": 1,
      "diagnostics": [],
      "downstreamImpact": "Language distribution is illustrative context only."
    }
  },
  "contributorSource": {
    "sourceType": "all_contributors",
    "path": ".all-contributorsrc",
    "coverage": {
      "family": "contributor_source",
      "source": "bundled tutorial sample",
      "status": "partial",
      "attempts": 1,
      "diagnostics": ["Synthetic contributor hints omit one reviewer to demonstrate partial profile context."],
      "downstreamImpact": "Contributor-aware comment-source hints are available; scoring and person-level outputs are unchanged."
    },
    "hintCount": 3
  },
  "pullRequests": [
    {
      "number": 101,
      "title": "feat: add route health dashboard",
      "author": { "login": "sample-author-ui", "type": "User" },
      "url": "https://example.com/pull/101",
      "state": "MERGED",
      "createdAt": "2026-05-04T09:00:00Z",
      "mergedAt": "2026-05-05T16:30:00Z",
      "updatedAt": "2026-05-05T16:45:00Z",
      "baseRefName": "main",
      "headRefName": "sample/route-health-dashboard",
      "headRefOid": "sample101merge",
      "additions": 410,
      "deletions": 96,
      "changedFiles": 5,
      "prOpenDiff": { "source": "direct", "confidence": "high", "additions": 190, "deletions": 44, "changedFiles": 5 },
      "commits": [
        { "oid": "sample101a", "authoredDate": "2026-05-04T08:40:00Z", "committedDate": "2026-05-04T08:42:00Z", "messageHeadline": "feat: add route health dashboard" },
        { "oid": "sample101b", "authoredDate": "2026-05-05T12:15:00Z", "committedDate": "2026-05-05T12:16:00Z", "messageHeadline": "test: cover delayed route states" }
      ],
      "files": [
        { "path": "apps/web/src/routes/RouteHealthPanel.tsx", "additions": 140, "deletions": 22, "changeType": "ADDED" },
        { "path": "apps/web/src/routes/RouteHealthChart.tsx", "additions": 94, "deletions": 16, "changeType": "ADDED" },
        { "path": "services/api/src/routes/health-summary.ts", "additions": 78, "deletions": 18, "changeType": "MODIFIED" },
        { "path": "tests/integration/route-health.test.ts", "additions": 82, "deletions": 20, "changeType": "ADDED" },
        { "path": "CHANGELOG.md", "additions": 16, "deletions": 20, "changeType": "MODIFIED" }
      ],
      "reviews": [
        { "id": "sample-review-101-a", "author": { "login": "sample-reviewer-a", "type": "User" }, "submittedAt": "2026-05-04T14:20:00Z", "state": "CHANGES_REQUESTED", "commitOid": "sample101a", "generatedCommentCount": 0, "failedAttempt": true },
        { "id": "sample-review-101-b", "author": { "login": "sample-reviewer-a", "type": "User" }, "submittedAt": "2026-05-05T15:20:00Z", "state": "APPROVED", "commitOid": "sample101b", "generatedCommentCount": 0, "failedAttempt": false }
      ],
      "reviewThreads": {
        "source": "bundled tutorial sample:review_threads",
        "totalCount": 2,
        "nodes": [
          { "id": "sample-thread-101-a", "isResolved": true, "isOutdated": false, "path": "apps/web/src/routes/RouteHealthPanel.tsx", "line": 88, "comments": [
            { "databaseId": "sample-comment-101-a", "author": { "login": "sample-reviewer-a", "type": "User" }, "path": "apps/web/src/routes/RouteHealthPanel.tsx", "line": 88, "originalLine": 88, "createdAt": "2026-05-04T14:21:00Z", "updatedAt": "2026-05-04T14:21:00Z", "url": "https://example.com/pull/101#discussion-sample-101-a" },
            { "databaseId": "sample-comment-101-b", "author": { "login": "sample-author-ui", "type": "User" }, "path": "apps/web/src/routes/RouteHealthPanel.tsx", "line": 88, "originalLine": 88, "createdAt": "2026-05-05T12:18:00Z", "updatedAt": "2026-05-05T12:18:00Z", "url": "https://example.com/pull/101#discussion-sample-101-b" }
          ] },
          { "id": "sample-thread-101-b", "isResolved": true, "isOutdated": true, "path": "services/api/src/routes/health-summary.ts", "line": 41, "comments": [
            { "databaseId": "sample-comment-101-c", "author": { "login": "sample-reviewer-b", "type": "User" }, "path": "services/api/src/routes/health-summary.ts", "line": 41, "originalLine": 41, "createdAt": "2026-05-04T15:02:00Z", "updatedAt": "2026-05-04T15:02:00Z", "url": "https://example.com/pull/101#discussion-sample-101-c" }
          ] }
        ]
      },
      "statusCheckRollup": [
        { "__typename": "CheckRun", "name": "unit", "context": null, "workflowName": "CI", "status": "COMPLETED", "conclusion": "SUCCESS", "startedAt": "2026-05-04T09:10:00Z", "completedAt": "2026-05-04T09:16:00Z" },
        { "__typename": "CheckRun", "name": "integration", "context": null, "workflowName": "CI", "status": "COMPLETED", "conclusion": "FAILURE", "startedAt": "2026-05-04T09:12:00Z", "completedAt": "2026-05-04T09:24:00Z" },
        { "__typename": "CheckRun", "name": "integration", "context": null, "workflowName": "CI", "status": "COMPLETED", "conclusion": "SUCCESS", "startedAt": "2026-05-05T12:20:00Z", "completedAt": "2026-05-05T12:31:00Z" }
      ],
      "workflowRuns": {
        "source": "bundled tutorial sample:workflow_runs",
        "totalCount": 2,
        "conclusions": { "success": 1, "failure": 1 },
        "runs": [
          { "id": "sample-run-101-a", "name": "CI", "workflowName": "CI", "headSha": "sample101a", "headBranch": "sample/route-health-dashboard", "event": "pull_request", "status": "completed", "conclusion": "failure", "createdAt": "2026-05-04T09:10:00Z", "updatedAt": "2026-05-04T09:24:00Z", "runStartedAt": "2026-05-04T09:12:00Z", "htmlUrl": "https://example.com/actions/runs/sample-run-101-a" },